  <!ELEMENT monarcas (monarca+)>
  <!ELEMENT monarca (nombrre, inicio_reinado, fin_reinado, dinastia)>
  <!ATTLIST monarca
    id ID #IMPLIED
  >
  <!ELEMENT nombrre (#PCDATA)>
  <!ELEMENT inicio_reinado (#PCDATA)>
  <!ELEMENT fin_reinado (#PCDATA)>
  <!ELEMENT dinastia (#PCDATA)>
